variable_name,description,data_type,min,max,units,enumerations,comment
name,Name of the entity.,string,,,,,
email,An email address to reach the entity.,string,,,,,
institution_id,The institution this record is associated with.,string,,,,,Foreign Key: Institution.institution_id
practitioner_role_id,Global ID for this record,string,,,,,Foreign Key: PractitionerRole.practitioner_role_id
description,More details associated with the given resource,string,,,,,
practitioner_title,"The title of the Investigator, eg, ""Assistant Professor""",string,,,,,
family,The family the participant is a part of,string,,,,,Foreign Key: Family.family_global_id
practitioner_id,The Global ID for the Practitioner.,string,,,,,
